{"artifacts":[{"ciphertexts":[{"party":"lab-a","sha256":"88dcc828897b1adb9907fd16353d7248b8539e9116ca897c3e13eb7dfd60fc46","sizeBytes":123,"uri":"local://lab-a/rooms/cancer-collaboration-room/states/S1/artifacts/match-mask.share.enc"},{"party":"lab-b","sha256":"5b9662ee02ec1e8233f73e19e4251ea0ceb9cdb17f405958599f3a4619287b80","sizeBytes":123,"uri":"local://lab-b/rooms/cancer-collaboration-room/states/S1/artifacts/match-mask.share.enc"}],"cryptoContextId":"secretflow-spu-cheetah-fm128-v1","dtype":"int32","id":"match-mask","includesIdentifiers":false,"kind":"spu-secret-share","mediaType":"application/vnd.kryptroom.spu-share+encrypted","shape":[8,8],"visibility":"secret-shared"},{"ciphertexts":[{"party":"lab-a","sha256":"01fd482dc68c2d279ac6a8584d985e04cfc4343a1f6e63d50d05e0436b4a9785","sizeBytes":123,"uri":"local://lab-a/rooms/cancer-collaboration-room/states/S1/artifacts/lab-a-features.share.enc"},{"party":"lab-b","sha256":"ba073acf26e9960dd3b215ac731a8ad7e326476228e06cf709b26287f1c7b21c","sizeBytes":123,"uri":"local://lab-b/rooms/cancer-collaboration-room/states/S1/artifacts/lab-a-features.share.enc"}],"cryptoContextId":"secretflow-spu-cheetah-fm128-v1","dtype":"int32","id":"lab-a-features","includesIdentifiers":false,"kind":"spu-secret-share","mediaType":"application/vnd.kryptroom.spu-share+encrypted","shape":[8,8,1],"visibility":"secret-shared"},{"ciphertexts":[{"party":"lab-a","sha256":"954aa06fb1f07776797120a42fb67e814a9eb2a9033f86e19e88b849718a4c3f","sizeBytes":123,"uri":"local://lab-a/rooms/cancer-collaboration-room/states/S1/artifacts/lab-b-features.share.enc"},{"party":"lab-b","sha256":"dea45fe2e7b12bdb8db8ab2922b48ef54d396cf4a2eae4c32998c5bba462d256","sizeBytes":123,"uri":"local://lab-b/rooms/cancer-collaboration-room/states/S1/artifacts/lab-b-features.share.enc"}],"cryptoContextId":"secretflow-spu-cheetah-fm128-v1","dtype":"int32","id":"lab-b-features","includesIdentifiers":false,"kind":"spu-secret-share","mediaType":"application/vnd.kryptroom.spu-share+encrypted","shape":[8,8,1],"visibility":"secret-shared"}],"commitment":{"algorithm":"SHA-256","canonicalization":"json-sort-keys-v1","value":"cb23d577ab92e930d861c5bc3146be7539afe29f9ecc05001620d141daf87c7c"},"cryptoContext":{"artifactCipher":"AES-256-GCM","backend":"SecretFlow SPU","backendVersion":"1.14.0b0","field":"FM128","id":"secretflow-spu-cheetah-fm128-v1","keyScope":"per-kryptnode-local","participants":["lab-a","lab-b"],"protocol":"CHEETAH","securityModel":"semi-honest"},"id":"S1","parentStateIds":[],"policy":{"allowedInputArtifactIds":["match-mask","lab-a-features","lab-b-features"],"allowedOperators":["private_analytics","private_nn_training","private_model_evaluation"],"authorizedReveals":[{"name":"intersection-cardinality","recipients":["lab-a","lab-b","ui"]},{"name":"ciphertext-metadata","recipients":["lab-a","lab-b"]},{"name":"matched-feature-sum","recipients":["lab-a","lab-b"]},{"name":"model.evaluation.mse","recipients":["lab-a","lab-b"]}],"defaultReveal":"deny","futureIdentifierDisclosure":{"requiresExplicitOptIn":true},"matchedIdentifierReveal":"forbidden","plaintextMaterialization":"forbidden"},"roomId":"cancer-collaboration-room","schemaVersion":"1","transition":{"bindings":{"cohortCardinality":6},"effectiveAt":"2026-10-16T00:00:00Z","id":"join-m4","inputJobId":"join-m4","operation":"private-join","outputArtifactIds":["match-mask","lab-a-features","lab-b-features"],"parentStateIds":[]}}