{"artifacts":[{"ciphertexts":[{"party":"lab-a","sha256":"236d46b44256cc8b5077d7c477193eeea42c1e984227b347f1fa6fca9f8db786","sizeBytes":123,"uri":"local://lab-a/rooms/cancer-collaboration-room/states/S3_model/artifacts/model-nn-layer1-weight.share.enc"},{"party":"lab-b","sha256":"0783b8f0b3a938f5693a0e52d0bb19a762fecd7d44424fe1cbc8bf7046a5078e","sizeBytes":123,"uri":"local://lab-b/rooms/cancer-collaboration-room/states/S3_model/artifacts/model-nn-layer1-weight.share.enc"}],"cryptoContextId":"secretflow-spu-cheetah-fm128-v1","dtype":"float32","id":"model-nn-layer1-weight","includesIdentifiers":false,"kind":"spu-secret-share","mediaType":"application/vnd.kryptroom.spu-share+encrypted","shape":[1,2],"visibility":"secret-shared"},{"ciphertexts":[{"party":"lab-a","sha256":"51466835c6845312a67f29876ad2d9c68b591f102df59a66ade13d1c569cfa4c","sizeBytes":123,"uri":"local://lab-a/rooms/cancer-collaboration-room/states/S3_model/artifacts/model-nn-layer1-bias.share.enc"},{"party":"lab-b","sha256":"4cf3dd782d38dcd11357c7fa280cccc7aa1683a82081a75be8d96ac170db8424","sizeBytes":123,"uri":"local://lab-b/rooms/cancer-collaboration-room/states/S3_model/artifacts/model-nn-layer1-bias.share.enc"}],"cryptoContextId":"secretflow-spu-cheetah-fm128-v1","dtype":"float32","id":"model-nn-layer1-bias","includesIdentifiers":false,"kind":"spu-secret-share","mediaType":"application/vnd.kryptroom.spu-share+encrypted","shape":[2],"visibility":"secret-shared"},{"ciphertexts":[{"party":"lab-a","sha256":"50e2666721ae54565f5e60e4d7db69d340f8b3794d2dbf0f3133e91b65f7d978","sizeBytes":123,"uri":"local://lab-a/rooms/cancer-collaboration-room/states/S3_model/artifacts/model-nn-output-weight.share.enc"},{"party":"lab-b","sha256":"ea19573dd32e8a33f24b3df2dbf0ded1ff57b3e7b62cae9ae2139c3310080fe2","sizeBytes":123,"uri":"local://lab-b/rooms/cancer-collaboration-room/states/S3_model/artifacts/model-nn-output-weight.share.enc"}],"cryptoContextId":"secretflow-spu-cheetah-fm128-v1","dtype":"float32","id":"model-nn-output-weight","includesIdentifiers":false,"kind":"spu-secret-share","mediaType":"application/vnd.kryptroom.spu-share+encrypted","shape":[2,1],"visibility":"secret-shared"},{"ciphertexts":[{"party":"lab-a","sha256":"1707e902c9eebb2d56b84086c41bc028e1bad6ee10c71b27cb2545a5e1e0115b","sizeBytes":123,"uri":"local://lab-a/rooms/cancer-collaboration-room/states/S3_model/artifacts/model-nn-output-bias.share.enc"},{"party":"lab-b","sha256":"7f96b238b676e0d8ecc8aa741a81c58d6f04d33a8b6d9852aba87a61de4a8580","sizeBytes":123,"uri":"local://lab-b/rooms/cancer-collaboration-room/states/S3_model/artifacts/model-nn-output-bias.share.enc"}],"cryptoContextId":"secretflow-spu-cheetah-fm128-v1","dtype":"float32","id":"model-nn-output-bias","includesIdentifiers":false,"kind":"spu-secret-share","mediaType":"application/vnd.kryptroom.spu-share+encrypted","shape":[1],"visibility":"secret-shared"}],"commitment":{"algorithm":"SHA-256","canonicalization":"json-sort-keys-v1","value":"0995e7ecd45325e45f2e4de880d4cc8bf16e7a7d7aa2484595f0051ab6ff3e9d"},"cryptoContext":{"artifactCipher":"AES-256-GCM","backend":"SecretFlow SPU","backendVersion":"1.14.0b0","field":"FM128","id":"secretflow-spu-cheetah-fm128-v1","keyScope":"per-kryptnode-local","participants":["lab-a","lab-b"],"protocol":"CHEETAH","securityModel":"semi-honest"},"id":"S3_model","parentStateIds":["S1"],"policy":{"allowedInputArtifactIds":["model-nn-layer1-weight","model-nn-layer1-bias","model-nn-output-weight","model-nn-output-bias"],"allowedOperators":["private_model_evaluation"],"authorizedReveals":[{"name":"ciphertext-metadata","recipients":["lab-a","lab-b"]},{"name":"model.evaluation.mse","recipients":["lab-a","lab-b"]}],"defaultReveal":"deny","futureIdentifierDisclosure":{"requiresExplicitOptIn":true},"matchedIdentifierReveal":"forbidden","plaintextMaterialization":"forbidden"},"roomId":"cancer-collaboration-room","schemaVersion":"1","transition":{"bindings":{"operator":"private_nn_training","outputArtifactCommitments":["23551ed238b11255682122008cc3a15b0a6fc7813178fa9145497d2e795fc8e9","33f72921c883258f200f409e74f643be272a7894b4c7bb1c9ec3e073ab60b347","99a773229772b85a8609bf2e2fed515eff9357a5c9c892f6f3988d2e28a26556","4b6714edcc6fe85eadc9922d213ad1a462d0515b514fabbc7a96005b8e0c000f"],"outputStateId":"S3_model","request":{"codeHash":"a8d0e674afa5b9bbdb5fa1d1c7cee1a7b31f997b0112b09683c997748d58a2ff","cryptoContextHash":"9e0dd267df3b932e612ba0b466275ad094d6705606142f2b61949c7eacad046a","featureNormalizationDivisor":10,"featureSelector":{"artifact":"lab-a-features","column":0,"divideBy":10},"initializer":{"algorithm":"kryptroom-sha256-uniform-v1","commitment":"547d74a56796d6833917860e53466138cc7015b8221997fcf821092134ae260c","scale":0.3,"seed":1,"tensors":[{"name":"W1","shape":[1,2],"values":[-0.0411223635096415,0.06470747997864434]},{"name":"b1","shape":[2],"values":[-0.11834734431307015,0.06848773023168415]},{"name":"W2","shape":[2,1],"values":[0.29926219369615165,-0.21322631362323186]},{"name":"b2","shape":[1],"values":[0.10769245207928142]}]},"inputPolicyHash":"77cc6a5df6a878f60514865ac06ee83baba73b8c68ccc776ad7fc82afd6fea06","inputs":[{"artifactRef":{"ciphertexts":[{"party":"lab-a","sha256":"88dcc828897b1adb9907fd16353d7248b8539e9116ca897c3e13eb7dfd60fc46","sizeBytes":123,"uri":"local://lab-a/rooms/cancer-collaboration-room/states/S1/artifacts/match-mask.share.enc"},{"party":"lab-b","sha256":"5b9662ee02ec1e8233f73e19e4251ea0ceb9cdb17f405958599f3a4619287b80","sizeBytes":123,"uri":"local://lab-b/rooms/cancer-collaboration-room/states/S1/artifacts/match-mask.share.enc"}],"cryptoContextId":"secretflow-spu-cheetah-fm128-v1","dtype":"int32","id":"match-mask","includesIdentifiers":false,"kind":"spu-secret-share","mediaType":"application/vnd.kryptroom.spu-share+encrypted","shape":[8,8],"visibility":"secret-shared"},"commitment":"0b2e2e34f774fe01bf86bf86d50df80dba1c9d3f13f9044dd63a328e5fc0d1f2"},{"artifactRef":{"ciphertexts":[{"party":"lab-a","sha256":"01fd482dc68c2d279ac6a8584d985e04cfc4343a1f6e63d50d05e0436b4a9785","sizeBytes":123,"uri":"local://lab-a/rooms/cancer-collaboration-room/states/S1/artifacts/lab-a-features.share.enc"},{"party":"lab-b","sha256":"ba073acf26e9960dd3b215ac731a8ad7e326476228e06cf709b26287f1c7b21c","sizeBytes":123,"uri":"local://lab-b/rooms/cancer-collaboration-room/states/S1/artifacts/lab-a-features.share.enc"}],"cryptoContextId":"secretflow-spu-cheetah-fm128-v1","dtype":"int32","id":"lab-a-features","includesIdentifiers":false,"kind":"spu-secret-share","mediaType":"application/vnd.kryptroom.spu-share+encrypted","shape":[8,8,1],"visibility":"secret-shared"},"commitment":"a2b416dd2bea5c03bd91c5efcc2b5208f8addcba8fb2a3e8d8d191c6ef7c0bfb"},{"artifactRef":{"ciphertexts":[{"party":"lab-a","sha256":"954aa06fb1f07776797120a42fb67e814a9eb2a9033f86e19e88b849718a4c3f","sizeBytes":123,"uri":"local://lab-a/rooms/cancer-collaboration-room/states/S1/artifacts/lab-b-features.share.enc"},{"party":"lab-b","sha256":"dea45fe2e7b12bdb8db8ab2922b48ef54d396cf4a2eae4c32998c5bba462d256","sizeBytes":123,"uri":"local://lab-b/rooms/cancer-collaboration-room/states/S1/artifacts/lab-b-features.share.enc"}],"cryptoContextId":"secretflow-spu-cheetah-fm128-v1","dtype":"int32","id":"lab-b-features","includesIdentifiers":false,"kind":"spu-secret-share","mediaType":"application/vnd.kryptroom.spu-share+encrypted","shape":[8,8,1],"visibility":"secret-shared"},"commitment":"a90d6fae27d7d20fc6e563b2d51b09a05f5c7ae89f65fd547e58e65903c773f3"}],"labelNormalizationDivisor":1000,"labelSelector":{"artifact":"lab-b-features","column":0,"divideBy":1000},"modelSpec":{"inputDim":1,"layers":[{"inputDim":1,"outputDim":2,"type":"dense"},{"type":"square"},{"inputDim":2,"outputDim":1,"type":"dense"}],"outputInterpretation":"normalized_continuous_treatment_response","type":"feedforward_neural_network"},"modelSpecHash":"1f336e996deb13d09b165d0f61b83ea4da401ff3019ed11c5f86a2e53c83d50f","operator":"private_nn_training","outputPolicy":{"allowedInputArtifactIds":["model-nn-layer1-weight","model-nn-layer1-bias","model-nn-output-weight","model-nn-output-bias"],"allowedOperators":["private_model_evaluation"],"authorizedReveals":[{"name":"ciphertext-metadata","recipients":["lab-a","lab-b"]},{"name":"model.evaluation.mse","recipients":["lab-a","lab-b"]}],"defaultReveal":"deny","futureIdentifierDisclosure":{"requiresExplicitOptIn":true},"matchedIdentifierReveal":"forbidden","plaintextMaterialization":"forbidden"},"outputPolicyHash":"1a7d67bf4c746a788b90d63a9e715b0615d82c263055ad7abc1b8a8379c38f99","outputStateId":"S3_model","parentStateCommitment":"cb23d577ab92e930d861c5bc3146be7539afe29f9ecc05001620d141daf87c7c","parentStateId":"S1","requestedRevealsHash":"4f53cda18c2baa0c0354bb5f9a3ecbe5ed12ab4d8e11ba873c2f11161202b945","trainingSpec":{"feature":{"artifact":"lab-a-features","column":0,"divideBy":10},"initializer":{"algorithm":"kryptroom-sha256-uniform-v1","scale":0.3,"seed":1},"label":{"artifact":"lab-b-features","column":0,"divideBy":1000},"learningRate":0.4,"loss":"masked_mse","optimizer":"full_batch_gradient_descent","shuffle":false,"steps":4},"trainingSpecHash":"9af1a10ccf07cfd01e2ca66f6a9d2b5b497a2776d5b62c15bbcfb683bed3c461","transition":{"effectiveAt":"2026-10-16T00:01:00Z","inputStateIds":["S1"],"operator":"private_nn_training","outputStateId":"S3_model","requestedReveals":[],"transitionId":"private-nn-training-to-S3"},"version":"1","workflowHash":"d66c581c73dbe1953f73fc573d9377da3e792b350bc0f516475e57fef5ff5449"},"transitionCommitment":"be53b27e7df5d5c16594dc9a1df779e5291ab7fc4196f3aa03ec037314f3010f"},"effectiveAt":"2026-10-16T00:01:00Z","id":"private-nn-training-to-S3","inputJobId":"private-nn-training-to-S3","operation":"private_nn_training","outputArtifactIds":["model-nn-layer1-weight","model-nn-layer1-bias","model-nn-output-weight","model-nn-output-bias"],"parentStateIds":["S1"]}}